{
  "name": "uBlock filters",
  "sources": [
    {
      "name": "uBlock filters",
      "source": "https://raw.githubusercontent.com/pkrayzy/HostlistCompiler/master/SourceLists/adguard.txt",
      "type": "adblock"
    }
  ],
  "exclusions_sources": [
    "https://raw.githubusercontent.com/pkrayzy/HostlistCompiler/master/optimized/filter.txt",
    "https://raw.githubusercontent.com/pkrayzy/HostlistCompiler/master/SourceLists/easylist.txt",
    "https://raw.githubusercontent.com/pkrayzy/HostlistCompiler/master/SourceLists/exclusions.txt"
  ],
  "transformations": [
    "Deduplicate"
  ]
}