{
  "name": "HaGeZi's Pro mini DNS/Browser Blocklist",
  "description": "Size-optimised version for DNS/Browser adblockers, e.g. for devices with less RAM. This list only contains domains from the Pro full that have been found on Top 1/10M lists (Umbrella, Cloudflare, Tranco, Chrome, BuiltWith, Majestic, DomCop).",
  "homepage": "https://github.com/AdguardTeam/AdguardSDNSFilter",
  "license": "GPLv3",
  "sources": [
    {
      "name": "HaGeZi's Pro mini DNS/Browser Blocklist",
      "source": "https://raw.githubusercontent.com/hagezi/dns-blocklists/refs/heads/main/adblock/pro.mini.txt",
      "type": "adblock",
      "transformations": ["RemoveModifiers", "Compress", "Validate"]
    },
    {
      "name": "Brave Filter",
      "source": "https://raw.githubusercontent.com/brave/adblock-lists/refs/heads/master/brave-lists/brave-ios-specific.txt",
      "type": "adblock",
      "transformations": ["RemoveModifiers", "Compress", "Validate"]
    },
    {
      "name": "EasyPrivacy Admiral",
      "source": "https://raw.githubusercontent.com/easylist/easylist/master/easyprivacy/easyprivacy_trackingservers_admiral.txt",
      "type": "adblock",
      "transformations": ["RemoveModifiers", "Compress", "Validate"]
    }
  ],
  "transformations": ["Deduplicate", "Compress"],
  "exclusions_sources": [
        "https://raw.githubusercontent.com/hagezi/dns-blocklists/refs/heads/main/adblock/whitelist-referral-native.txt",
        "https://raw.githubusercontent.com/hagezi/dns-blocklists/refs/heads/main/adblock/whitelist-referral.txt",
        "https://raw.githubusercontent.com/pkrayzy/FiltersCompiler/master/filters/DNSexclusions.txt",
        "https://raw.githubusercontent.com/pkrayzy/HostlistCompiler/master/oisd_excludes.txt",
        "https://raw.githubusercontent.com/pkrayzy/HostlistCompiler/master/oisd_unresolved.txt",
        "https://raw.githubusercontent.com/pkrayzy/WarpWhitelist/main/lists/dynamic_whitelist.txt"
      ]
}
