{
  "name": "AdGuard Simplified Domain Names filter",
  "description": "Filter composed from several other filters (English filter, Social media filter, Spyware filter, Mobile ads filter, EasyList and EasyPrivacy) and simplified specifically to be better compatible with DNS-level ad blocking.",
  "homepage": "https://github.com/AdguardTeam/AdguardSDNSFilter",
  "license": "GPLv3",
  "sources": [
    {
      "name": "HaGeZi's Light",
      "source": "https://raw.githubusercontent.com/hagezi/dns-blocklists/main/adblock/light.txt",
      "type": "adblock"
    },
    {
      "name": "AdGuard DNS filter",
      "source": "https://raw.githubusercontent.com/pkrayzy/HostlistCompiler/master/SourceLists/adguard_dns.txt",
      "type": "adblock",
      "exclusions": [
        "||dotomi.com"
      ],
      "exclusions_sources": [
        "https://raw.githubusercontent.com/AdguardTeam/AdGuardSDNSFilter/master/Filters/exclusions.txt",
        "https://raw.githubusercontent.com/pkrayzy/HostlistCompiler/master/SourceLists/dns_whitelist.txt"
      ]
    },
    {
      "name": "EasyPrivacy Admiral",
      "source": "https://raw.githubusercontent.com/easylist/easylist/master/easyprivacy/easyprivacy_trackingservers_admiral.txt",
      "type": "adblock"
    },
  {
      "name": "Brave Admiral",
      "source": "https://raw.githubusercontent.com/pkrayzy/HostlistCompiler/master/SourceLists/brave_admiral.txt",
      "type": "adblock"
    },
    {
      "name": "HaGeZi Native Apple",
      "source": "https://raw.githubusercontent.com/hagezi/dns-blocklists/main/adblock/native.apple.txt",
      "type": "adblock"
    },
    {
      "name": "HaGeZi Native Amazon",
      "source": "https://raw.githubusercontent.com/hagezi/dns-blocklists/main/adblock/native.amazon.txt",
      "type": "adblock"
    },
    {
      "name": "HaGeZi Native Samsung",
      "source": "https://raw.githubusercontent.com/hagezi/dns-blocklists/main/adblock/native.samsung.txt",
      "type": "adblock"
    },
    {
      "name": "HaGeZi Native WinOffice",
      "source": "https://raw.githubusercontent.com/hagezi/dns-blocklists/main/adblock/native.winoffice.txt",
      "type": "adblock"
    }
  ],
  "exclusions_sources": [
    "https://raw.githubusercontent.com/pkrayzy/HostlistCompiler/master/SourceLists/dns_exclusions.txt",
    "https://raw.githubusercontent.com/hagezi/dns-blocklists/main/adblock/blocklist-referral-native.txt"
  ],
  "transformations": [
    "Deduplicate",
    "Compress",
    "Validate",
    "RemoveComments"
  ]
}
