{
  "name": "EasyList Content Blocker",
  "description": "Compilation of EasyList Fliters, Excluding Domains Blocked by DNS",
  "homepage": "https://github.com/AdguardTeam/AdguardSDNSFilter",
  "license": "GPLv3",
  "sources": [
    {
      "name": "Adguard Scriplets",
      "source": "https://raw.githubusercontent.com/pkrayzy/HostlistCompiler/master/SourceLists/adguard_scriptlets.txt",
      "type": "adblock"
    },
    {
      "name": "EasyList",
      "source": "https://raw.githubusercontent.com/pkrayzy/HostlistCompiler/master/SourceLists/easylist.txt",
      "type": "adblock"
    },
    {
      "name": "Referrals Allowlist",
      "source": "https://hagezi-mirror.dnsbunker.org/adblock/whitelist-referral.txt",
      "type": "adblock",
      "exclusions": [
        "@@||ad.doubleclick.net^"
      ]
    },
    {
      "name": "EasyPrivacy",
      "source": "https://raw.githubusercontent.com/pkrayzy/HostlistCompiler/master/SourceLists/easyprivacy.txt",
      "type": "adblock",
      "exclusions_sources": [
        "https://raw.githubusercontent.com/pkrayzy/HostlistCompiler/master/SourceLists/cname.txt"
      ]
    },
    {
      "name": "EasyCookie",
      "source": "https://raw.githubusercontent.com/pkrayzy/HostlistCompiler/master/SourceLists/easycookie.txt",
      "type": "adblock"
    }
  ],
  "exclusions_sources": [
    "https://raw.githubusercontent.com/pkrayzy/HostlistCompiler/master/optimized/filter.txt",
    "https://raw.githubusercontent.com/pkrayzy/HostlistCompiler/master/SourceLists/exclusions.txt"
  ],
  "transformations": [
    "Deduplicate"
  ]
}