{
  "name": "AdGuard Base filters (Optimized)",
  "description": "Compilation of AdGuard Base Filters, Excluding Domains Blocked by DNS",
  "homepage": "https://github.com/AdguardTeam/AdguardSDNSFilter",
  "license": "GPLv3",
  "sources": [
    {
      "name": "EasyList",
      "source": "https://raw.githubusercontent.com/pkrayzy/HostlistCompiler/master/SourceLists/adguard.txt",
      "type": "adblock"
    },
    {
      "name": "AdGuard Privacy Protection filters",
      "source": "https://raw.githubusercontent.com/pkrayzy/HostlistCompiler/master/SourceLists/adguard_privacy.txt",
      "type": "adblock",
      "exclusions_sources": [
        "https://raw.githubusercontent.com/AdguardTeam/cname-trackers/master/data/combined_disguised_ads.txt",
        "https://raw.githubusercontent.com/AdguardTeam/cname-trackers/master/data/combined_disguised_clickthroughs.txt",
        "https://raw.githubusercontent.com/AdguardTeam/cname-trackers/master/data/combined_disguised_microsites.txt",
        "https://raw.githubusercontent.com/AdguardTeam/cname-trackers/master/data/combined_disguised_trackers.txt",
        "https://raw.githubusercontent.com/AdguardTeam/cname-trackers/master/data/combined_disguised_mail_trackers.txt"
      ]
    },
    {
      "name": "AdGuard Annoyances filters",
      "source": "https://raw.githubusercontent.com/pkrayzy/HostlistCompiler/master/SourceLists/adguard_annoyances.txt",
      "type": "adblock"
    }
  ],
  "exclusions_sources": [
    "https://raw.githubusercontent.com/pkrayzy/HostlistCompiler/master/optimized/filter.txt",
    "https://raw.githubusercontent.com/pkrayzy/HostlistCompiler/master/SourceLists/exclusions.txt"
  ],
  "transformations": [
    "Deduplicate"
  ]
}
