{
  "name": "Quick Fixes Filter",
  "description": "Filter to quickly resolve content filtering issues on popular websites without updating the extension",
  "homepage": "https://github.com/AdguardTeam/AdguardSDNSFilter",
  "license": "GPLv3",
  "sources": [
    {
      "name": "Krayzylist",
      "source": "https://raw.githubusercontent.com/pkrayzy/Krayzylist/main/Blocklist",
      "type": "adblock"
    },
    {
      "name": "uBlock",
      "source": "https://raw.githubusercontent.com/pkrayzy/HostlistCompiler/master/optimized/ublock.txt",
      "type": "adblock"
    },
    {
      "name": "Paywalls",
      "source": "https://raw.githubusercontent.com/pkrayzy/HostlistCompiler/master/optimized/paywalls.txt",
      "type": "adblock"
    }
  ],
  "exclusions_sources": [
    "https://raw.githubusercontent.com/pkrayzy/HostlistCompiler/master/optimized/filter.txt",
    "https://raw.githubusercontent.com/pkrayzy/HostlistCompiler/master/optimized/exclusions.txt"
  ],
  "transformations": [
    "Deduplicate"
  ]
}