{
  "name": "Krayzylist",
  "sources": [
    {
      "name": "Krayzylist",
      "source": "https://raw.githubusercontent.com/pkrayzy/Krayzylist/main/Blocklist",
      "type": "adblock"
    }
  ],
  "exclusions_sources": [
    "https://raw.githubusercontent.com/pkrayzy/HostlistCompiler/master/SourceLists/exclusions.txt"
  ],
  "transformations": [
    "Deduplicate"
  ]
}