{
  "name": "uBlock filters",
  "sources": [
    {
      "name": "uBlock filters",
      "source": "https://raw.githubusercontent.com/pkrayzy/HostlistCompiler/master/SourceLists/ublock_filters.txt",
      "type": "adblock"
    }
  ],
  "exclusions_sources": [
    "https://raw.githubusercontent.com/pkrayzy/HostlistCompiler/master/SourceLists/filter.txt",
    "https://raw.githubusercontent.com/pkrayzy/HostlistCompiler/master/SourceLists/exclusions.txt"
  ],
  "transformations": [
    "Deduplicate"
  ]
}